{"inputs":{"cases":{"sha256":"569a7555d79eef8f2d0af370c2811711ecb2a953b0594b288a743e661913d48c"},"questions":{"sha256":"86cb628c529dfc1ebc44ee81c3fb3c2ac2558e748b386e9e344fa4c49ba8e9a7"},"requirements":{"sha256":"b35c1ca03a49f71566bf4b2daff4d89f27a3a2780879aa32f6b86087f8b0d048"},"responses":{"sha256":"15d34d5b9fa0e2cf77b39122202949f9c0449dec674b81c01b2ff0732315c527"}},"outputs":{"EVALUATION.md":{"sha256":"7374c5c9ff6d54b027bad64bcd504bee35de1d750f23ee24104c996bd423c027"},"cases.jsonl":{"sha256":"1c2a5c2616346ebcc7c658fe649e0d5d04bf46f00591bb6ce73374e3a2fc5b98"},"evaluation.json":{"sha256":"0524b35027b643b5fb07cb51567d1861584fac7c982b1835eba4e7634001ebd4"},"questions.json":{"sha256":"86cb628c529dfc1ebc44ee81c3fb3c2ac2558e748b386e9e344fa4c49ba8e9a7"},"requirements.json":{"sha256":"b35c1ca03a49f71566bf4b2daff4d89f27a3a2780879aa32f6b86087f8b0d048"},"responses.jsonl":{"sha256":"8b010e1378557007f38c22e0c20552cfdf49301ee78bc0cbcd271d8654f29ef2"}},"produced_by":{"name":"jevdecision","version":"0.2.0"},"response_mode":"replay","response_origin":"unverified: supplied replay responses may be hand-written; model fields do not authenticate provider output","schema_version":2}