{"inputs":{"cases":{"sha256":"569a7555d79eef8f2d0af370c2811711ecb2a953b0594b288a743e661913d48c"},"questions":{"sha256":"86cb628c529dfc1ebc44ee81c3fb3c2ac2558e748b386e9e344fa4c49ba8e9a7"},"requirements":{"sha256":"b6836e42f8ca4feed04c4dc6bc550b6a63eab7ab0bb2a94c8a48064d22736378"},"responses":{"sha256":"15d34d5b9fa0e2cf77b39122202949f9c0449dec674b81c01b2ff0732315c527"}},"outputs":{"EVALUATION.md":{"sha256":"ce113f4767d544bb7c54fa78ba0250c9a418e8c3eeae7d4987eff38c65575f93"},"cases.jsonl":{"sha256":"1c2a5c2616346ebcc7c658fe649e0d5d04bf46f00591bb6ce73374e3a2fc5b98"},"evaluation.json":{"sha256":"9f10f974582cde50b902340fb6c363d07ce73eef7ecac2a6cefd356f44fdf687"},"questions.json":{"sha256":"86cb628c529dfc1ebc44ee81c3fb3c2ac2558e748b386e9e344fa4c49ba8e9a7"},"requirements.json":{"sha256":"b6836e42f8ca4feed04c4dc6bc550b6a63eab7ab0bb2a94c8a48064d22736378"},"responses.jsonl":{"sha256":"8b010e1378557007f38c22e0c20552cfdf49301ee78bc0cbcd271d8654f29ef2"}},"produced_by":{"name":"jevdecision","version":"0.1.0"},"response_mode":"replay","response_origin":"unverified: supplied replay responses may be hand-written; model fields do not authenticate provider output","schema_version":2}