{"inputs":{"cases":{"sha256":"926924f047dd247f58e8476930ad0bc600b4f76b9b11c3b99613af3ee8a0b18e"},"questions":{"sha256":"86cb628c529dfc1ebc44ee81c3fb3c2ac2558e748b386e9e344fa4c49ba8e9a7"},"requirements":null,"responses":null},"outputs":{"EVALUATION.md":{"sha256":"de9df3d7accc0d0593a32651d61fff223dcfa98beb70abd62ee4a23f3d4849ef"},"cases.jsonl":{"sha256":"99198538444eff2ea561c67b031259cd5670e7c5e75891f19afecb8ecbf774aa"},"evaluation.json":{"sha256":"3ec938a8f2eb388bd44dcd3d6d3746201dd33070266d7f1fc8af33820ac244cc"},"questions.json":{"sha256":"86cb628c529dfc1ebc44ee81c3fb3c2ac2558e748b386e9e344fa4c49ba8e9a7"},"responses.jsonl":{"sha256":"d1c712da0d75e2deeb6c5d72da9af37aef0c480c214fb3cf467c8d528541eb84"}},"produced_by":{"name":"jevdecision","version":"0.1.0"},"response_mode":"live","response_origin":"live: responses obtained by this CLI through the configured backend","schema_version":2}